{
  "review_id": "REV-20260417-001",
  "timestamp": "2026-04-17T10:00:00Z",
  "participants": [
    "User",
    "AI Agent"
  ],
  "task_type": "Feature Implementation",
  "decisions": [
    "采用了 JWT 方案替代 Session 以支持跨端状态同步"
  ],
  "success_factors": [
    "提前定义了清晰的 API 接口契约"
  ],
  "failure_reasons": [
    "未对外部接口设置超时重试机制导致前端状态卡死"
  ],
  "best_practices": [
    "所有对外部服务的调用必须设置超时机制和重试策略"
  ],
  "action_items": [
    "在全局请求拦截器中增加统一的超时重试逻辑",
    "将 JWT 解析逻辑封装为通用 Hook"
  ],
  "status": "active"
}