{
  "review_id": "REV-20260417-003",
  "timestamp": "2026-04-17T09:28:23Z",
  "participants": [
    "dao-genesis",
    "user"
  ],
  "task_type": "开发 CLI 辅助工具",
  "decisions": [
    "不做交互式提示补全",
    "自动填充为空数组以满足 Schema"
  ],
  "success_factors": [
    "Contract 里强制要求缺失值为 `[]`。"
  ],
  "failure_reasons": [],
  "best_practices": [],
  "action_items": [
    "在 `README.md` 里增加该工具的使用说明。",
    "补充单元测试。"
  ],
  "status": "active"
}
